{
  "$schema": "http://json-schema.org/draft-07/schema#",
  "title": "generalized C++ verifier manifest",
  "type": "object",
  "required": ["task_id", "candidate_files", "policies"],
  "properties": {
    "schema_version": {"type": "integer", "const": 1},
    "task_id": {
      "type": "string",
      "pattern": "^[a-z0-9]+(?:[._-][a-z0-9]+)*$"
    },
    "source": {"type": "string"},
    "candidate_files": {
      "type": "array",
      "minItems": 1,
      "items": {"type": "string"},
      "description": "Candidate file paths relative to the candidate directory; exactly one header plus optional sources."
    },
    "protected_files": {
      "type": "object",
      "additionalProperties": {
        "type": "string",
        "pattern": "^[0-9a-f]{64}$"
      }
    },
    "fixture_dir": {
      "type": "string",
      "description": "Task fixture directory: exactly one <stem>_test.cpp, a test/ harness (tests-main.cpp, catch.hpp), and .meta/example.h with optional .meta/example.cpp. Required by wrappers G01, G02, G03, G06, G07."
    },
    "policies": {
      "type": "object",
      "description": "Policy map keyed by policy id; presence of each requested policy key (G02..) is required by the runner. Entries are advisory command records.",
      "patternProperties": {
        "^G0[1-7]$": {"type": "array"}
      },
      "additionalProperties": false
    },
    "response_file": {
      "type": "string",
      "description": "Path to the raw model response text (fallback when no trajectory turn carries one). Used by wrappers G04 and G05."
    },
    "response_text": {
      "type": "string",
      "description": "Inline raw model response text (fallback). Used by wrappers G04 and G05."
    },
    "trajectory": {
      "type": "object",
      "properties": {
        "turn_limit": {"type": "integer"},
        "turns": {
          "type": "array",
          "items": {
            "type": "object",
            "properties": {
              "turn": {"type": "integer"},
              "response_file": {"type": "string"},
              "response_text": {"type": "string"},
              "response_receipt": {"type": "object"},
              "generated_feedback": {"type": "string"},
              "delivered_feedback": {"type": "string"}
            },
            "additionalProperties": true
          }
        }
      },
      "additionalProperties": true
    }
  },
  "additionalProperties": true
}
