{
  "candidate_files": [
    "grade_school.cpp",
    "grade_school.h"
  ],
  "fixture_dir": "multi_env_fixtures/grade-school",
  "policies": {
    "G02": [],
    "G03": [],
    "G04": [],
    "G05": [],
    "G06": [],
    "G07": []
  },
  "protected_files": {
    ".docs/instructions.md": "8dc7133cd5f0564717108757c27ad96ebadf44f03b5fde5c35b826aaeb0b4e0f",
    ".meta/config.json": "28bdbbdbb8c293860d1608973841b5fd4ded9bb28e3e92d9c3fa3bbdcd5ca5e2",
    ".meta/example.cpp": "1cdf88a95c3fb712a3ba13ff04f27e2cf499c6a9cc8c1bb0b0248a9f5b9b8f29",
    ".meta/example.h": "5b6a05abfaf2b3c73976db3ddbd86adb283c1e5110e93f3d3b7f9032adc34f1b",
    ".meta/tests.toml": "d7bf3a16b90fdc327262561be5b1da32e4d7a8e0ce45658c9d426004fd03a09a",
    "CMakeLists.txt": "53d531120e650972adf19a2a42aa2d5bc716c93700ffac74c1c2868fdce633ff",
    "grade_school.cpp": "d71a5ca592c6a8d2c3163eeb63cdb866ae0357d43fd34b43c4861401912b5fb2",
    "grade_school.h": "6f3ef5ce0e1d8c9b7d72d04e087e7979540194210c99468cf6dfafefc3ee7d46",
    "grade_school_test.cpp": "3a6f4266831b6d31b022e764bed44d1c02cfa10f7629f91053c02e0d53b29871",
    "test/catch.hpp": "681e7505a50887c9085539e5135794fc8f66d8e5de28eadf13a30978627b0f47",
    "test/tests-main.cpp": "5847fda35c1320d94f8d088aaf34229d689f66f1da235f885cbb28c8f17e4260"
  },
  "schema_version": 1,
  "source": "official:Aider-AI/polyglot-benchmark@7e0611e77b54e2dea774cdc0aa00cf9f7ed6144f/cpp/exercises/practice/grade-school",
  "task_id": "grade-school"
}
