{
  "candidate_files": [
    "complex_numbers.cpp",
    "complex_numbers.h"
  ],
  "fixture_dir": "multi_env_fixtures/complex-numbers",
  "policies": {
    "G02": [],
    "G03": [],
    "G04": [],
    "G05": [],
    "G06": [],
    "G07": []
  },
  "protected_files": {
    ".docs/instructions.md": "32d74988f93a781b3b27fc6750f4f41bcdf7b4d462904389d409e9ad606063fb",
    ".meta/config.json": "14edd9b7f0d96411138d757267a67a67ed853bfaa1a94daa2d90f7aef6b8082f",
    ".meta/example.cpp": "690bd58562e2898bc3aeca8ea911b740f31ca2cf508ca2a4465bb80fa2f6440e",
    ".meta/example.h": "c129b8a67bed8a94964d95592382de06b8c8510ebfb19aea996b8b45cc781bd0",
    ".meta/tests.toml": "0dc04cbfa1c1ae0deadc9cf515a0dbf567159656528565816e284979e925c723",
    "CMakeLists.txt": "53d531120e650972adf19a2a42aa2d5bc716c93700ffac74c1c2868fdce633ff",
    "complex_numbers.cpp": "7621ce4527c8a6a0524e2140b38cb23a3981013e84712b095b88db6587a465ab",
    "complex_numbers.h": "e08ab6734e9b6a5abd59be8bad5e1936db652651e6f92ed519e3dd1060d9a8b6",
    "complex_numbers_test.cpp": "0bb911210fddcfe066825d5b562ca6efbf21d45386e62aebfd4693ad1b82897b",
    "test/catch.hpp": "681e7505a50887c9085539e5135794fc8f66d8e5de28eadf13a30978627b0f47",
    "test/tests-main.cpp": "5847fda35c1320d94f8d088aaf34229d689f66f1da235f885cbb28c8f17e4260"
  },
  "schema_version": 1,
  "source": "official:Aider-AI/polyglot-benchmark@7e0611e77b54e2dea774cdc0aa00cf9f7ed6144f/cpp/exercises/practice/complex-numbers",
  "task_id": "complex-numbers"
}
